{
  "skill": "demo",
  "kit_id": "kit-abc123",
  "date": "2026-10-01T00:00:00Z",
  "platform": "claude-code",
  "model": "claude-sonnet-4",
  "runs": [
    {
      "case_id": "K1",
      "arm": "with",
      "run": 1,
      "passed": true,
      "checks": [
        {
          "id": "K1-c1",
          "passed": true
        }
      ]
    },
    {
      "case_id": "K1",
      "arm": "with",
      "run": 2,
      "passed": true,
      "checks": [
        {
          "id": "K1-c1",
          "passed": true
        }
      ]
    },
    {
      "case_id": "K2",
      "arm": "with",
      "run": 1,
      "passed": true,
      "checks": [
        {
          "id": "K2-c1",
          "passed": true
        }
      ]
    },
    {
      "case_id": "K2",
      "arm": "with",
      "run": 2,
      "passed": false,
      "checks": [
        {
          "id": "K2-c1",
          "passed": false
        }
      ]
    },
    {
      "case_id": "K1",
      "arm": "without",
      "run": 1,
      "passed": true,
      "checks": [
        {
          "id": "K1-c1",
          "passed": true
        }
      ]
    },
    {
      "case_id": "K1",
      "arm": "without",
      "run": 2,
      "passed": false,
      "checks": [
        {
          "id": "K1-c1",
          "passed": false
        }
      ]
    },
    {
      "case_id": "K2",
      "arm": "without",
      "run": 1,
      "passed": false,
      "checks": [
        {
          "id": "K2-c1",
          "passed": false
        }
      ]
    },
    {
      "case_id": "K2",
      "arm": "without",
      "run": 2,
      "passed": false,
      "checks": [
        {
          "id": "K2-c1",
          "passed": false
        }
      ]
    },
    {
      "case_id": "T1",
      "arm": "with",
      "run": 1,
      "passed": true,
      "checks": [
        {
          "id": "T1-c1",
          "passed": true
        }
      ]
    },
    {
      "case_id": "T2",
      "arm": "with",
      "run": 1,
      "passed": false,
      "checks": [
        {
          "id": "T2-c1",
          "passed": false
        }
      ]
    },
    {
      "case_id": "T3",
      "arm": "with",
      "run": 1,
      "passed": true,
      "checks": [
        {
          "id": "T3-c1",
          "passed": true
        }
      ]
    }
  ]
}